{
    "$schema": "http://json-schema.org/draft-06/schema#",
    "$ref": "#/definitions/NodeTrainingConfiguration",
    "definitions": {
        "NodeTrainingConfiguration": {
            "type": "object",
            "additionalProperties": false,
            "properties": {
                "author": {
                    "type": "string",
                    "description": "author name"
                },
                "specs": {
                    "type": "string",
                    "description": "spec url for downloading/uploading"
                },
                "callback": {
                    "type": "string",
                    "description": "test result callback"
                },
                "role": {
                    "type": "string",
                    "description": "user role",
                    "enum": [
                        "trainee",
                        "trainer"
                    ]
                },
                "credential": {
                    "$ref": "#/definitions/Credential"
                }
            },
            "required": [
                "author",
                "role"
            ],
            "title": "NodeTrainingConfiguration"
        },
        "Credential": {
            "type": "object",
            "additionalProperties": false,
            "properties": {
                "username": {
                    "type": "string"
                },
                "password": {
                    "type": "string"
                }
            },
            "required": [
                "password",
                "username"
            ],
            "title": "Credential"
        }
    }
}