{
    "author": "Fiona Zhou",
    "specs": "https://couchdb.eu-central.fornever.org/training_spec/cim-training",
    "callback": "https://couchdb.eu-central.fornever.org/training_result",
    "role": "trainee",
    "credential": {
        "username": "training",
        "password": "training"
    }
}